{
  "id": "2026-10-21-2200",
  "published_at": "2026-10-21T22:00:00+08:00",
  "headline": "【示例】仅供校验，不是已发布新闻",
  "sections": {
    "x_daily": [
      {
        "title": "【示例】实验室动态",
        "summary": "这是一条示例摘要，用来确认摄取脚本能写入期刊文件。请勿把本文件当作新闻发布。",
        "source_url": "https://example.com/ai-lianmeng/sample-x",
        "time": "2026-10-21T21:12:00+08:00",
        "handle": "@example"
      }
    ],
    "zh_topics": [
      {
        "title": "【示例】中文博主",
        "summary": "示例中文摘要，说明这一栏会展示中文博主。",
        "source_url": "https://example.com/ai-lianmeng/sample-zh",
        "time": "2026-10-21T18:05:00+08:00",
        "handle": "@example_zh"
      }
    ],
    "en_topics": [
      {
        "title": "【示例】并入 AI 日报的旧英文条目",
        "summary": "sections.en_topics 已停用。这条仍能通过校验，并会显示在 AI 日报里。",
        "source_url": "https://example.com/ai-lianmeng/sample-en",
        "time": "2026-10-21T16:40:00+08:00"
      }
    ],
    "oss_agent": [
      {
        "title": "【示例】开源与 Agent 技术",
        "summary": "示例摘要，说明这一栏会展示开源项目和 Agent 技术。",
        "source_url": "https://example.com/ai-lianmeng/sample-oss",
        "time": "2026-10-21T15:20:00+08:00",
        "handle": "@example_oss"
      }
    ],
    "tech": [
      {
        "title": "【示例】科技与数码",
        "summary": "示例摘要，说明这一栏会展示科技与数码选题。",
        "source_url": "https://example.com/ai-lianmeng/sample-tech",
        "time": "2026-10-21T14:05:00+08:00"
      }
    ],
    "iot": [
      {
        "title": "【示例】万物互联",
        "summary": "示例摘要，说明这一栏会展示万物互联选题。",
        "source_url": "https://example.com/ai-lianmeng/sample-iot",
        "time": "2026-10-21T13:40:00+08:00",
        "handle": "@example_iot"
      }
    ]
  }
}
